{
  "phase": "data-understanding",
  "status": "GO",
  "started_at": "2026-07-28T11:33:15.061883",
  "completed_at": "2026-07-28T11:33:15.061885",
  "inputs": [
    "data/raw/daily_withdrawals.csv",
    "docs/product-brief.md"
  ],
  "outputs": [
    "notebooks/01_data_understanding.ipynb",
    "reports/01_data_understanding.md",
    "manifests/01_data_understanding.json"
  ],
  "decisions": [
    "Datos aptos para modelado temporal",
    "Features de calendario y lags son viables"
  ],
  "metrics": {
    "rows": 730,
    "date_range_days": 730,
    "nulls": 0,
    "duplicates": 0,
    "target_mean_cop": 140905340992.6507,
    "target_cv_pct": 24.454535232423925,
    "trend_growth_pct": 42.0,
    "weekend_effect_pct": -3.0,
    "holiday_effect_pct": -28.0,
    "payday_effect_pct": 7.0
  },
  "assumptions": [
    "Granularidad diaria es suficiente",
    "730 d\u00edas capturan patrones relevantes",
    "transaction_count se refiere al d\u00eda D, no D+1"
  ],
  "risks": [
    "Tendencia creciente puede afectar baselines",
    "Pocos festivos en la muestra (36)",
    "Sin variables ex\u00f3genas"
  ],
  "tests_executed": [
    "schema_validation",
    "null_check",
    "duplicate_check",
    "continuity_check"
  ],
  "human_approval_required": true,
  "human_approved": false,
  "next_agent": "data-preparation"
}